{"schema_version":1,"run_id":"pr_4dec89bcc88156e4","analysis_id":"an_2d7768d29368c85cbdef71fad5833d19","policy_hash":"219d728ccef8be2aec0d5511ee71551b8001cb179906f14c2292bb58de37923f","status":"requires_ack","coverage":{"rate_model_ppm":1000000,"path_policy_coverage_ppm":1000000},"totals":{"observed_requests":3,"allowed_requests":2,"denied_requests":1,"rate_limited_requests":0,"cache_candidate_requests":0,"bytes_avoided":321,"upstream_us_avoided":null,"allocated_cost_avoided_kopecks":null},"rule_impacts":[{"rule_id":"allow-googlebot","action":"allow","matched_requests":1,"allowed":1,"denied":0,"rate_limited":0,"bytes_avoided":0,"upstream_us_avoided":null,"allocated_cost_avoided_kopecks":null,"claimed_crawlers_affected":["Googlebot"],"top_routes_affected":["/robots.txt"],"metric_coverage_ppm":1000000,"path_policy_coverage_ppm":null,"eligible_observed":0,"cache_misses_observed":0,"warnings":[]},{"rule_id":"deny-wp-admin","action":"deny","matched_requests":1,"allowed":0,"denied":1,"rate_limited":0,"bytes_avoided":321,"upstream_us_avoided":null,"allocated_cost_avoided_kopecks":null,"claimed_crawlers_affected":[],"top_routes_affected":["/wp-admin/login"],"metric_coverage_ppm":1000000,"path_policy_coverage_ppm":1000000,"eligible_observed":0,"cache_misses_observed":0,"warnings":[]}],"risks":[{"id":"claimed-allow-bypass:allow-googlebot","severity":"medium","acknowledgeable":true,"message":"A spoofable claimed User-Agent may bypass a later restrictive rule."}],"assumptions":["Historical requests are evaluated independently of crawler adaptation.","Cache impact ignores response Cache-Control, Set-Cookie, authorization and Vary.","Crawler identity is claimed from User-Agent and is not DNS-verified."]}
